Date,Headline,URL,Opening Text,Hit Sentence,Source,Influencer,Country,Subregion,Language,Reach,Desktop Reach,Mobile Reach,Twitter Social Echo,Facebook Social Echo,Reddit Social Echo,National Viewership,Engagement,AVE,Sentiment,Key Phrases,Input Name,Keywords,Twitter Authority,Tweet Id,Twitter Id,Twitter Client,Twitter Screen Name,User Profile Url,Twitter Bio,Twitter Followers,Twitter Following,Alternate Date Format,Time,State,City,Document Tags
16-Mar-2021 04:34PM,,http://twitter.com/israel_cardenas/statuses/1371907866622357505,,"RT @rmcardenas: Uruguay además ya es el segundo país de América Latina con más dosis administradas como porcentaje de su población. La cooperación Chile-Uruguay dando frutos! ???? Países de América Latina sin Chile: https://t.co/bhGeUUqAly ; LATAM trae desde Beijing, dos millones de dosis más de vacunas SINOVAC para Chile, y un millón seiscientas mil dosis para Uruguay. El vuelo desde Sydney llega mañana a Santiago pasadas las 9AM. Después de las 13 horas, arribará a Montevideo. Sigue la cooperación ????",Twitter,@israel_cardenas,Chile,,Spanish / Castilian,1321,0,0,,,,0,,12.22,Neutral,"millones de dosis,segundo país de América Latina",Adhoc Search Export,"Uruguay,LATAM,vuelo,Montevideo",6,'1371907866622357505',341578091,Twitter for Android,Israel Cárdenas A.,http://www.twitter.com/israel_cardenas,"...Cuando los chilenos vean lo que es el Comunismo, cuando los chilenos entiendan como los están engañando, van a darse cuenta que este Gobierno tenía Razón!!!",1321,2482,"Mar 16, 2021",4:34 PM,Santiago Metropolitan,Santiago,
16-Mar-2021 04:18PM,,http://twitter.com/DANIELIBARBURU/statuses/1371903813083365382,,RT @faguerre75: Sobrevuela Mdeo. el vuelo de LATAM con más de un millón y medio de dosis SINOVAC provenientes de China. Hay orden de no aflojar... Cuando se abra tu franja agendate .. De esta salimos entre todos... #UruguaySeVacuna https://t.co/JkzQOaiFyG,Twitter,@DANIELIBARBURU,Uruguay,,Spanish / Castilian,3197,0,0,,,,0,,29.57,Neutral,vuelo de LATAM,Adhoc Search Export,"uruguaysevacuna,vuelo,LATAM,UruguaySeVacuna",7,'1371903813083365382',181255571,Twitter Web App,Vasco Ibarburu,http://www.twitter.com/DANIELIBARBURU,Empecinadamente blanco y gran hincha Wilsonista de Luis Lacalle Pou  y Javier García del espacio40 del Partido Nacional.,3197,2457,"Mar 16, 2021",4:18 PM,Montevideo,Montevideo,
16-Mar-2021 04:17PM,,http://www.facebook.com/1473382256280023/posts/2958255307792703,,"Cno. Carrasco 151 esq. Manual Albo, Paso Carrasco, Canelones \nLun. a Vie. de 8:30 a 18 hs. Sáb. de 9 a 13 hs. \nwww.pascualautomoviles.com.uy",Facebook,Pascual Automoviles,Unknown,,Spanish / Castilian,10494,0,0,,,,0,0,97.07,Neutral,"centralizado de puertas,mayor precio de plaza,óptima asesoría",Adhoc Search Export,"pasajero,equipaje,Carrasco,uy",,,,,,http://www.facebook.com/1473382256280023,,,,"Mar 16, 2021",4:17 PM,,,
16-Mar-2021 04:17PM,,https://twitter.com/pillolarrea/statuses/1371903449776807937,,"QT @CambeiroThiago: RT @CambeiroThiago: 12:46 PM toco pista el Avión de Latam Cargo (LA9572) llegando así el cargamento más grande de Vacunas hasta ahora (1.5 Millones).\n FALTA MENOS!\n#UruguaySeVacuna\n\n@TIRANDO1010 https://t.co/aUwpa8nP5w ; El Avión Latam (LA9572) está a menos de una hora de llegar a Montevideo con 1.5 Millones de #Vacunas (Sinovac) Cargó en Beijing, hizo escala en Sydney, para luego llegar a Santiago de Chile, descargar las vacunas que les correspondian y seguir vuelo hacia nuestro país. https://t.co/smNHqm8wrI",Twitter,@pillolarrea,Uruguay,,Spanish / Castilian,30031,0,0,,,,0,,277.79,Neutral,,Adhoc Search Export,"uruguaysevacuna,Avión,Latam,UruguaySeVacuna,Montevideo,vuelo",9,'1371903449776807937',301619602,Twitter for Android,RODOLFO LARREA,https://twitter.com/pillolarrea,Periodista:\n*Tirando Paredes: 11 Años! \n*Columnista: @AsiNosVa850\n*Ex: Fox Sports.\nClaro Concreto Contundente.\n@tirando1010 \nhttp://tirandoparedes.com.uy,30031,5618,"Mar 16, 2021",4:17 PM,Montevideo,Montevideo,
16-Mar-2021 04:01PM,,http://twitter.com/Robi_Flon/statuses/1371899328307027969,,"RT @EugeFigueroaB: LATAM trae desde Beijing, dos millones de dosis más de vacunas SINOVAC para Chile, y un millón seiscientas mil dosis para Uruguay. El vuelo desde Sydney llega mañana a Santiago pasadas las 9AM. Después de las 13 horas, arribará a Montevideo. Sigue la cooperación ????",Twitter,@Robi_Flon,Chile,,Spanish / Castilian,579,0,0,,,,0,,5.36,Neutral,millones de dosis,Adhoc Search Export,"Montevideo,LATAM,Uruguay,vuelo",5,'1371899328307027969',159631567,Twitter for Android,Robi_Flon,http://www.twitter.com/Robi_Flon,"Melomano, Imaginativo e incrédulo y en contra de los fanatismos extremos.",579,740,"Mar 16, 2021",4:01 PM,Tarapacá,Iquique,
16-Mar-2021 03:59PM,,http://twitter.com/Magdalena10Ara/statuses/1371899007388246024,,RT @faguerre75: Sobrevuela Mdeo. el vuelo de LATAM con más de un millón y medio de dosis SINOVAC provenientes de China. Hay orden de no aflojar... Cuando se abra tu franja agendate .. De esta salimos entre todos... #UruguaySeVacuna https://t.co/JkzQOaiFyG,Twitter,@Magdalena10Ara,Uruguay,,Spanish / Castilian,513,0,0,,,,0,,4.75,Neutral,vuelo de LATAM,Adhoc Search Export,"uruguaysevacuna,UruguaySeVacuna,vuelo,LATAM",5,'1371899007388246024',2246075984,Twitter for Android,Magda ??,http://www.twitter.com/Magdalena10Ara,,513,473,"Mar 16, 2021",3:59 PM,,,
16-Mar-2021 03:59PM,,https://twitter.com/GuilleHambrook/statuses/1371898841470009346,,"RT @Hambrook7: Acá viene llegando el @LATAM_URU con las vacunas Sinovac. Hechos, no palabras. https://t.co/oUzuZ7kukO",Twitter,@guillehambrook,Uruguay,,Spanish / Castilian,384,0,0,,,,0,,3.55,Positive,,Adhoc Search Export,LATAM_URU,4,'1371898841470009346',"1,28104624545751E+018",Twitter for iPhone,Guillermo Hambrook,https://twitter.com/GuilleHambrook,"Cortos en las promesas, largos en el cumplimiento.",384,183,"Mar 16, 2021",3:59 PM,,,
16-Mar-2021 02:49PM,,http://twitter.com/nuevacomuy_/statuses/1371881252756803584,,A las 12.45 llegó el avión de @LATAM_URU proveniente de Beijing con las 1.580.000 dosis restantes de Sinovac; luego de un recorrido de 41.931 kilómetros recorridos atravesando 12 husos horarios. Gracias!! https://t.co/Uo8BotUYsT,Twitter,@nuevacomuy_,Uruguay,,Spanish / Castilian,210,0,0,,,,0,,1.94,Neutral,husos horarios,Adhoc Search Export,LATAM_URU,4,'1371881252756803584',"7,95792141343719E+017",Twitter Web App,Nueva Comunicación,http://www.twitter.com/nuevacomuy_,"Agencia de comunicación corporativa, prensa y organización de eventos con 20 años de experiencia en el rubro.",210,522,"Mar 16, 2021",2:49 PM,Montevideo,Montevideo,
16-Mar-2021 02:44PM,,https://twitter.com/Antoniopiko6273/statuses/1371880057845743626,,@LATAM_URU gracias LATAM x traer las vacunas a Uruguay!!! @sebastianpinera,Twitter,@antoniopiko6273,United States,,Spanish / Castilian,267,0,0,,,,0,,2.47,Neutral,,Adhoc Search Export,LATAM_URU,4,'1371880057845743626',2780443247,Twitter for Android,Antonio,https://twitter.com/Antoniopiko6273,"Andando por jardines y senderos que se bifurcan (J.L.Borges)\nHetero invert.\nLibertad, trabajo, mérito, familia y patria. Luchador incansable contra los rojos!",267,540,"Mar 16, 2021",2:44 PM,Arkansas,Magnolia,
16-Mar-2021 02:40PM,,https://twitter.com/Daniel21029766/statuses/1371879050055184399,,"RT @Alfonso_quincke: VACUNAS A URUGUAY ??!! Hace unos minutos, despegaba el vuelo LA9572 de la aerolínea LATAM con poco más de 1.500.000 dosis de la Vacuna CoronaVac de la farmacéutica Sinovac. La hora de arribo se estima en 13:15hs. El avión en cuestión es un B787-9 matriculado CC-BGN. https://t.co/xTmymqZ7o9",Twitter,@daniel21029766,Uruguay,,Spanish / Castilian,606,0,0,,,,0,,5.61,Neutral,hora de arribo,Adhoc Search Export,"URUGUAY,vuelo,LATAM,avión",5,'1371879050055184399',"1,14838486674621E+018",Twitter for Android,Daniel 1970,https://twitter.com/Daniel21029766,"Solo hay dos formas de vivir la vida, una como si nada fuera un milagro. La otra es hacerlo como si todo fuera un milagro. A.Einstein",606,1913,"Mar 16, 2021",2:40 PM,Montevideo,Montevideo,
16-Mar-2021 02:40PM,,http://twitter.com/Daniel21029766/statuses/1371878973337112576,,RT @faguerre75: Sobrevuela Mdeo. el vuelo de LATAM con más de un millón y medio de dosis SINOVAC provenientes de China. Hay orden de no aflojar... Cuando se abra tu franja agendate .. De esta salimos entre todos... #UruguaySeVacuna https://t.co/JkzQOaiFyG,Twitter,@Daniel21029766,Uruguay,,Spanish / Castilian,606,0,0,,,,0,,5.61,Neutral,vuelo de LATAM,Adhoc Search Export,"uruguaysevacuna,vuelo,LATAM,UruguaySeVacuna",5,'1371878973337112576',"1,14838486674621E+018",Twitter for Android,Daniel 1970,http://www.twitter.com/Daniel21029766,"Solo hay dos formas de vivir la vida, una como si nada fuera un milagro. La otra es hacerlo como si todo fuera un milagro. A.Einstein",606,1913,"Mar 16, 2021",2:40 PM,Montevideo,Montevideo,
16-Mar-2021 02:06PM,,https://twitter.com/viper_787/statuses/1371870494396407821,,"RT @Alfonso_quincke: VACUNAS A URUGUAY ??!! Hace unos minutos, despegaba el vuelo LA9572 de la aerolínea LATAM con poco más de 1.500.000 dosis de la Vacuna CoronaVac de la farmacéutica Sinovac. La hora de arribo se estima en 13:15hs. El avión en cuestión es un B787-9 matriculado CC-BGN. https://t.co/xTmymqZ7o9",Twitter,@viper_787,France,,Spanish / Castilian,34,0,0,,,,0,,0.31,Neutral,hora de arribo,Adhoc Search Export,"avión,URUGUAY,vuelo,LATAM",2,'1371870494396407821',"7,39245234866E+017",Twitter for Android,Karl0s,https://twitter.com/viper_787,"Saludos Cordiales. Si sos liberal, ¿Qué hacés en esta cuenta?",34,462,"Mar 16, 2021",2:06 PM,Occitanie,Montcuq,
16-Mar-2021 01:59PM,,http://twitter.com/ACoalicion/statuses/1371868790603059200,,RT @faguerre75: Sobrevuela Mdeo. el vuelo de LATAM con más de un millón y medio de dosis SINOVAC provenientes de China. Hay orden de no aflojar... Cuando se abra tu franja agendate .. De esta salimos entre todos... #UruguaySeVacuna https://t.co/JkzQOaiFyG,Twitter,@ACoalicion,Unknown,,Spanish / Castilian,117,0,0,,,,0,,1.08,Neutral,vuelo de LATAM,Adhoc Search Export,"uruguaysevacuna,UruguaySeVacuna,vuelo,LATAM",3,'1371868790603059200',"1,2828185551222E+018",Twitter for Android,CoaliciónMunicipioA,http://www.twitter.com/ACoalicion,#Cambiar \nNO MÁS MONTEVIDEO OLVIDADO.  equipo siempre sumando militancia para el cambio junto @todos_Fabian,117,239,"Mar 16, 2021",1:59 PM,,,
16-Mar-2021 01:56PM,,https://twitter.com/NunezBorba/statuses/1371867874357284869,,RT @ComunidadAeron1: 1.558.000 vacunas trae el avión de Latam que aterrizo en esre momento ( 12 hs 46) en Carrasco https://t.co/NN1vf41zWv,Twitter,@nunezborba,Unknown,,Spanish / Castilian,367,0,0,,,,0,,3.39,Neutral,esre momento,Adhoc Search Export,"avión,Latam,Carrasco",5,'1371867874357284869',"1,07796535375237E+018",Twitter Web App,Mariel Nuñez de Borba,https://twitter.com/NunezBorba,"Licenciada en Psicologia, egresada de la UDELAR. Plastica egresada de la Escuela Nacional de Bellas Artes.",367,129,"Mar 16, 2021",1:56 PM,,,
16-Mar-2021 01:46PM,,http://twitter.com/EdilFernandez40/statuses/1371865391589429254,,RT @faguerre75: Sobrevuela Mdeo. el vuelo de LATAM con más de un millón y medio de dosis SINOVAC provenientes de China. Hay orden de no aflojar... Cuando se abra tu franja agendate .. De esta salimos entre todos... #UruguaySeVacuna https://t.co/JkzQOaiFyG,Twitter,@EdilFernandez40,Uruguay,,Spanish / Castilian,1970,0,0,,,,0,,18.22,Neutral,vuelo de LATAM,Adhoc Search Export,"uruguaysevacuna,vuelo,LATAM,UruguaySeVacuna",6,'1371865391589429254',219441681,Twitter for Android,Patricia Fernández Cohendet,http://www.twitter.com/EdilFernandez40,"Esposa y madre de 3 ????? familiera, amiga, animalista e idealista//\nEdil (s) por Montevideo periodo 2020-2025\nEspacio 40 - Partido Nacional",1970,3795,"Mar 16, 2021",1:46 PM,Montevideo,Montevideo,
16-Mar-2021 01:41PM,,https://twitter.com/ElChuniOriginal/statuses/1371864320540352512,,"RT @Hambrook7: Acá viene llegando el @LATAM_URU con las vacunas Sinovac. Hechos, no palabras. https://t.co/oUzuZ7kukO",Twitter,@elchunioriginal,Unknown,,Spanish / Castilian,170,0,0,,,,0,,1.57,Positive,,Adhoc Search Export,LATAM_URU,4,'1371864320540352512',772825411,Twitter Web App,juan ignacio zunino,https://twitter.com/ElChuniOriginal,,170,81,"Mar 16, 2021",1:41 PM,,,
16-Mar-2021 01:40PM,,http://twitter.com/dsorondo/statuses/1371863920399507456,,"RT @LuciaBetancur13: ? Arribó al Aeropuerto de Carrasco, proveniente China, el avión Latam con 1.558.000 dosis de Sinovac con las que se completarán las 1.750.000 que adquirió el gobierno a esta farmacéutica. @universal970 @970noticias https://t.co/dkGlrtZIpN",Twitter,@dsorondo,Uruguay,,Spanish / Castilian,11536,0,0,,,,0,,106.71,Neutral,,Adhoc Search Export,"Aeropuerto,Carrasco,avión,Latam",8,'1371863920399507456',487531498,Twitter for iPhone,Diego Sorondo,http://www.twitter.com/dsorondo,Papa de Thiago y Benja. Periodista. Gerente gral @universal970 /Productor de teatro/ Director DS Producciones /Docente periodismo en Ipep/ Productor @modoavion4,11536,1163,"Mar 16, 2021",1:40 PM,Montevideo,Montevideo,
16-Mar-2021 01:36PM,,https://twitter.com/guillerminameir/statuses/1371862955973877763,,"RT @Hambrook7: Acá viene llegando el @LATAM_URU con las vacunas Sinovac. Hechos, no palabras. https://t.co/oUzuZ7kukO",Twitter,@guillerminameir,Uruguay,,Spanish / Castilian,179,0,0,,,,0,,1.66,Positive,,Adhoc Search Export,LATAM_URU,4,'1371862955973877763',937383450,Twitter for iPad,guillerminameirelles,https://twitter.com/guillerminameir,,179,396,"Mar 16, 2021",1:36 PM,Salto,Salto,
16-Mar-2021 01:35PM,,https://twitter.com/MaierSusana/statuses/1371862789669670918,,QT @jotaleonetti: Igual que acá!! ; #AVIONES #COVID19 ?? Aterriza en #Montevideo el Cargo de @LATAMAirlines con 1.554.000 #vacunas de sinovac para #Uruguay ?? Mañana llegarán otras 400 mil de Pfizer. Se estima que para el 1° de abril habrá 1 millón de uruguayos vacunados. ? https://t.co/LjWd3dIZ2b https://t.co/FwiW0mKBpG,Twitter,@maiersusana,Unknown,,Spanish / Castilian,17,0,0,,,,0,,0.16,Positive,,Adhoc Search Export,"aviones,montevideo,uruguay,uruguayos,AVIONES,Montevideo,LATAMAirlines,Uruguay",2,'1371862789669670918',4075500159,Twitter for Android,susanamaier,https://twitter.com/MaierSusana,,17,159,"Mar 16, 2021",1:35 PM,,,
16-Mar-2021 01:34PM,,http://twitter.com/MECKANIC2/statuses/1371862362983178241,,"RT @EugeFigueroaB: LATAM trae desde Beijing, dos millones de dosis más de vacunas SINOVAC para Chile, y un millón seiscientas mil dosis para Uruguay. El vuelo desde Sydney llega mañana a Santiago pasadas las 9AM. Después de las 13 horas, arribará a Montevideo. Sigue la cooperación ????",Twitter,@MECKANIC2,Chile,,Spanish / Castilian,466,0,0,,,,0,,4.31,Neutral,millones de dosis,Adhoc Search Export,"Montevideo,LATAM,Uruguay,vuelo",5,'1371862362983178241',"1,35339821372689E+018",Twitter Web App,MECKANIC,http://www.twitter.com/MECKANIC2,"NUNCA UN TURISTA,SIEMPRE UN VIAJERO\nIngenieer BRAIN \n#DeLaSecta\nVictima del Pajaroazul progre que despojo mi cuenta y segidores\nLuchador Repubicano y Libertario",466,595,"Mar 16, 2021",1:34 PM,Region of Magallanes,,
16-Mar-2021 01:31PM,,http://twitter.com/getchandy/statuses/1371861597438803975,,RT @faguerre75: Sobrevuela Mdeo. el vuelo de LATAM con más de un millón y medio de dosis SINOVAC provenientes de China. Hay orden de no aflojar... Cuando se abra tu franja agendate .. De esta salimos entre todos... #UruguaySeVacuna https://t.co/JkzQOaiFyG,Twitter,@getchandy,Uruguay,,Spanish / Castilian,2344,0,0,,,,0,,21.68,Neutral,vuelo de LATAM,Adhoc Search Export,"uruguaysevacuna,UruguaySeVacuna,vuelo,LATAM",6,'1371861597438803975',175930223,Twitter Web App,Gabi E.S. ?? #UruguaySeVacuna,http://www.twitter.com/getchandy,"Ing. en sist., casada, uruguaya. Sobreviviendo con la nueva normalidad...#yoMeVacuno #UruguaySeVacuna",2344,4961,"Mar 16, 2021",1:31 PM,Montevideo,Montevideo,
16-Mar-2021 01:29PM,,https://twitter.com/ConurbaTourOK/statuses/1371861192168386565,,RT @jotaleonetti: #AVIONES #COVID19 ?? Aterriza en #Montevideo el Cargo de @LATAMAirlines con 1.554.000 #vacunas de sinovac para #Uruguay ?? Mañana llegarán otras 400 mil de Pfizer. Se estima que para el 1° de abril habrá 1 millón de uruguayos vacunados. ? https://t.co/LjWd3dIZ2b https://t.co/FwiW0mKBpG,Twitter,@conurbatourok,Argentina,,Spanish / Castilian,1227,0,0,,,,0,,11.35,Neutral,millón de uruguayos,Adhoc Search Export,"aviones,montevideo,uruguay,uruguayos,AVIONES,Montevideo,LATAMAirlines,Uruguay",6,'1371861192168386565',"1,1159774865868E+018",Twitter for Android,#ConurbaTour ???,https://twitter.com/ConurbaTourOK,"Yo conurbaneo, \nEl conurbanea, \nNosotros conurbaneamos, \nVosotros conurbaneais, \nEllos conurbanean. \n¿Tu conurbaneas? Compartilo acá! ??",1227,640,"Mar 16, 2021",1:29 PM,Buenos Aires F.D.,Buenos Aires,
16-Mar-2021 01:26PM,,http://twitter.com/GabrielGianoli/statuses/1371860440737779716,,RT @faguerre75: Sobrevuela Mdeo. el vuelo de LATAM con más de un millón y medio de dosis SINOVAC provenientes de China. Hay orden de no aflojar... Cuando se abra tu franja agendate .. De esta salimos entre todos... #UruguaySeVacuna https://t.co/JkzQOaiFyG,Twitter,@GabrielGianoli,Unknown,,Spanish / Castilian,3152,0,0,,,,0,,29.16,Neutral,vuelo de LATAM,Adhoc Search Export,"uruguaysevacuna,UruguaySeVacuna,vuelo,LATAM",7,'1371860440737779716',603982541,Twitter for Android,Gabriel Gianoli,http://www.twitter.com/GabrielGianoli,Representante Nacional  @EspacioCuarenta,3152,849,"Mar 16, 2021",1:26 PM,,,
16-Mar-2021 01:25PM,,http://twitter.com/JoseMRojas75/statuses/1371860180284055557,,"RT @EugeFigueroaB: LATAM trae desde Beijing, dos millones de dosis más de vacunas SINOVAC para Chile, y un millón seiscientas mil dosis para Uruguay. El vuelo desde Sydney llega mañana a Santiago pasadas las 9AM. Después de las 13 horas, arribará a Montevideo. Sigue la cooperación ????",Twitter,@JoseMRojas75,Argentina,,Spanish / Castilian,1076,0,0,,,,0,,9.95,Neutral,millones de dosis,Adhoc Search Export,"LATAM,Uruguay,vuelo,Montevideo",6,'1371860180284055557',788072084,Twitter Web App,Jose Rojas,http://www.twitter.com/JoseMRojas75,,1076,1647,"Mar 16, 2021",1:25 PM,Santa Fe,,
16-Mar-2021 01:23PM,,https://twitter.com/LuisdeS72485518/statuses/1371859729358675968,,QT @faguerre75: RT @danyrossi28: #UruguaySeVacuna #YoMeVacuno https://t.co/KisJeUiu2E ; Sobrevuela Mdeo. el vuelo de LATAM con más de un millón y medio de dosis SINOVAC provenientes de China. Hay orden de no aflojar... Cuando se abra tu franja agendate .. De esta salimos entre todos... #UruguaySeVacuna https://t.co/JkzQOaiFyG,Twitter,@luisdes72485518,Unknown,,Spanish / Castilian,521,0,0,,,,0,,4.82,Neutral,,Adhoc Search Export,"uruguaysevacuna,UruguaySeVacuna,vuelo,LATAM",5,'1371859729358675968',"1,27874283753488E+018",Twitter Web App,Luis de Souza,https://twitter.com/LuisdeS72485518,UN SABIO,521,1321,"Mar 16, 2021",1:23 PM,,,
16-Mar-2021 01:22PM,,https://twitter.com/faguerre75/statuses/1371859375497838595,,QT @faguerre75: RT @danyrossi28: #UruguaySeVacuna #YoMeVacuno ; Sobrevuela Mdeo. el vuelo de LATAM con más de un millón y medio de dosis SINOVAC provenientes de China. Hay orden de no aflojar... Cuando se abra tu franja agendate .. De esta salimos entre todos... #UruguaySeVacuna https://t.co/JkzQOaiFyG,Twitter,@faguerre75,Uruguay,,Spanish / Castilian,972,0,0,,,,0,,8.99,Neutral,,Adhoc Search Export,"uruguaysevacuna,UruguaySeVacuna,vuelo,LATAM",5,'1371859375497838595',3645612437,Twitter for Android,Fabian Aguerregoyen,https://twitter.com/faguerre75,Si retrocedes que sea unicamente para tomar impulso....Espacio 40 Municipio A.,972,1577,"Mar 16, 2021",1:22 PM,Montevideo,Montevideo,
16-Mar-2021 01:21PM,,http://twitter.com/danyrossi28/statuses/1371859294547816448,,QT @faguerre75: #UruguaySeVacuna #YoMeVacuno ; Sobrevuela Mdeo. el vuelo de LATAM con más de un millón y medio de dosis SINOVAC provenientes de China. Hay orden de no aflojar... Cuando se abra tu franja agendate .. De esta salimos entre todos... #UruguaySeVacuna https://t.co/JkzQOaiFyG,Twitter,@danyrossi28,Uruguay,,Spanish / Castilian,2287,0,0,,,,0,,21.15,Neutral,vuelo de LATAM,Adhoc Search Export,"uruguaysevacuna,UruguaySeVacuna,vuelo,LATAM",6,'1371859294547816448',2230650897,Twitter for Android,?? Daniela,http://www.twitter.com/danyrossi28,#AsumimosTodos,2287,1915,"Mar 16, 2021",1:21 PM,Montevideo,Montevideo,
16-Mar-2021 01:21PM,,https://twitter.com/DiazdeVivar9/statuses/1371859129640308742,,RT @jotaleonetti: #AVIONES #COVID19 ?? Aterriza en #Montevideo el Cargo de @LATAMAirlines con 1.554.000 #vacunas de sinovac para #Uruguay ?? Mañana llegarán otras 400 mil de Pfizer. Se estima que para el 1° de abril habrá 1 millón de uruguayos vacunados. ? https://t.co/LjWd3dIZ2b https://t.co/FwiW0mKBpG,Twitter,@diazdevivar9,Unknown,,Spanish / Castilian,1888,0,0,,,,0,,17.46,Neutral,millón de uruguayos,Adhoc Search Export,"aviones,montevideo,uruguay,uruguayos,AVIONES,Montevideo,LATAMAirlines,Uruguay",6,'1371859129640308742',81208395,Twitter for Android,Issabella ???,https://twitter.com/DiazdeVivar9,??,1888,3679,"Mar 16, 2021",1:21 PM,,,
16-Mar-2021 01:21PM,,https://twitter.com/MaierSusana/statuses/1371859064335040512,,RT @jotaleonetti: #AVIONES #COVID19 ?? Aterriza en #Montevideo el Cargo de @LATAMAirlines con 1.554.000 #vacunas de sinovac para #Uruguay ?? Mañana llegarán otras 400 mil de Pfizer. Se estima que para el 1° de abril habrá 1 millón de uruguayos vacunados. ? https://t.co/LjWd3dIZ2b https://t.co/FwiW0mKBpG,Twitter,@maiersusana,Unknown,,Spanish / Castilian,17,0,0,,,,0,,0.16,Neutral,millón de uruguayos,Adhoc Search Export,"aviones,montevideo,uruguay,uruguayos,AVIONES,Montevideo,LATAMAirlines,Uruguay",2,'1371859064335040512',4075500159,Twitter for Android,susanamaier,https://twitter.com/MaierSusana,,17,159,"Mar 16, 2021",1:21 PM,,,
16-Mar-2021 01:20PM,,http://twitter.com/universal970/statuses/1371858897900871686,,"RT @LuciaBetancur13: ? Arribó al Aeropuerto de Carrasco, proveniente China, el avión Latam con 1.558.000 dosis de Sinovac con las que se completarán las 1.750.000 que adquirió el gobierno a esta farmacéutica. @universal970 @970noticias https://t.co/dkGlrtZIpN",Twitter,@universal970,Uruguay,,Spanish / Castilian,18725,0,0,,,,0,,173.21,Neutral,,Adhoc Search Export,"Aeropuerto,Carrasco,avión,Latam",8,'1371858897900871686',303234033,Twitter Web App,970 Universal,http://www.twitter.com/universal970,Cuenta oficial de 970 Universal. Comunicate por Whatsapp al 092 000 970.\nInformativos @970noticias,18725,915,"Mar 16, 2021",1:20 PM,,,
16-Mar-2021 01:17PM,,https://twitter.com/Pablomalbo/statuses/1371858085858402306,,QT @jotaleonetti: El 33% de los charruas vacunados en pocos días ; #AVIONES #COVID19 ?? Aterriza en #Montevideo el Cargo de @LATAMAirlines con 1.554.000 #vacunas de sinovac para #Uruguay ?? Mañana llegarán otras 400 mil de Pfizer. Se estima que para el 1° de abril habrá 1 millón de uruguayos vacunados. ? https://t.co/LjWd3dIZ2b https://t.co/FwiW0mKBpG,Twitter,@pablomalbo,Unknown,,Spanish / Castilian,1174,0,0,,,,0,,10.86,Negative,,Adhoc Search Export,"aviones,montevideo,uruguay,uruguayos,AVIONES,Montevideo,LATAMAirlines,Uruguay",6,'1371858085858402306',633048614,Twitter for Android,Pablo ???,https://twitter.com/Pablomalbo,Nada por aquí nada por allá,1174,993,"Mar 16, 2021",1:17 PM,,,
16-Mar-2021 01:07PM,,https://twitter.com/jotaleonetti/statuses/1371855693469380617,,#AVIONES #COVID19 ?? Aterriza en #Montevideo el Cargo de @LATAMAirlines con 1.554.000 #vacunas de sinovac para #Uruguay ?? Mañana llegarán otras 400 mil de Pfizer. Se estima que para el 1° de abril habrá 1 millón de uruguayos vacunados. ? https://t.co/LjWd3dIZ2b https://t.co/FwiW0mKBpG,Twitter,@jotaleonetti,Argentina,,Spanish / Castilian,603783,0,0,,,,0,15,5584.99,Neutral,millón de uruguayos,Adhoc Search Export,"aviones,montevideo,uruguay,uruguayos,AVIONES,Montevideo,LATAMAirlines,Uruguay",10,'1371855693469380617',114879626,Twitter for Android,Jota Leonetti | Transito ?,https://twitter.com/jotaleonetti,Info de Tránsito de Jota Leonetti. \n#PeriodistaDeTránsito y #SeguridadVial.\nOrganiza #RSEvial.\nDirige y viaja con @Huespedes ??,603783,1298,"Mar 16, 2021",1:07 PM,Buenos Aires F.D.,Buenos Aires,
16-Mar-2021 01:07PM,,https://twitter.com/MariaCa00503855/statuses/1371855658983784454,,"RT @TelenocheUy: Este martes llegará a Uruguay un lote de 1.558.000 dosis de la vacuna CoronaVac, elaborado por el laboratorio chino Sinovac, en un avión cargo de la empresa Latam. https://t.co/nwYtuPKJUl",Twitter,@mariaca00503855,Uruguay,,Spanish / Castilian,316,0,0,,,,0,,2.92,Neutral,avión cargo,Adhoc Search Export,"Uruguay,avión,Latam",5,'1371855658983784454',"9,93546147057848E+017",Twitter for Android,MariaCabrera,https://twitter.com/MariaCa00503855,,316,813,"Mar 16, 2021",1:07 PM,Tacuarembó,Paso de los Toros,
16-Mar-2021 01:05PM,,http://twitter.com/Todos_Fabian/statuses/1371855177163153412,,RT @faguerre75: Sobrevuela Mdeo. el vuelo de LATAM con más de un millón y medio de dosis SINOVAC provenientes de China. Hay orden de no aflojar... Cuando se abra tu franja agendate .. De esta salimos entre todos... #UruguaySeVacuna https://t.co/JkzQOaiFyG,Twitter,@Todos_Fabian,Unknown,,Spanish / Castilian,2264,0,0,,,,0,,20.94,Neutral,vuelo de LATAM,Adhoc Search Export,"uruguaysevacuna,vuelo,LATAM,UruguaySeVacuna",6,'1371855177163153412',"1,07521465802443E+018",Twitter for Android,Fabián Vera,http://www.twitter.com/Todos_Fabian,"Insp.Técnico. 30años, familia, 4hijos\nDirigente político con Actitud gran apoyo demostrado, por el cambio #URUGUAY más Valores\n#Social\n#Deportivo\n#Cultura",2264,4866,"Mar 16, 2021",1:05 PM,,,
